Titel,Kapitel,Unterkapitel,Schlagworte,Laufzeit,Beschreibung,vimeo,youtube - deutsch,youtube - english
Proben-Vorbereitung,1,1,none,05:54,"Eine Labor-Tour kann nur mit der Proben-Vorbereitung beginnen, denn die Probe braucht für die verschiedenen Geräte eine jeweils bestimmte Präparation und Vorbereitung. Eigentlich sollte man in der Präparation selbst beginnen, um zu sehen, wo und wie aus einem Gestein oder einem anderem Material ein polierter Dick- oder Dünnschliff wird. Eine kurze Beschreibung muss für den Moment reichen: Ein Stein wird in ein Klötzchen gesägt, das auf einem Objektträger aufgeklebt wird. Das Klötzchen wird nochmals geschnitten und anschließend auf Poliermaschinen in mehreren Schritten mit immer feinerer Körnung (bis runter zu 1 µm) geschliffen, sodass eine hoch-polierte Proben-Oberfläche entsteht. Mit dieser fertigen Probe können wir aus der Präparation in die Proben-Vorbereitung.
Im ersten Schritt werden die Proben gereinigt und getrocknet. Es stehen außerdem zwei Geräte zur Verfügung (Cross-Section Polnischer & Ion-Slicer), um die Proben-Oberfläche weiter zu glätten, z.B. für EBSD-Messungen am Rasterelektronen-Mikroskop (REM)
In der Mikrosonde werden die Proben mit einem Elektronenstrahl beschossen. Dabei würden sich die Elektronen auf der Proben-Oberfläche in Millisekunden akkumulieren, und sich die Probe aufladen. Weitere Elektronen würden von den angesammelten Elektronen abgelenkt und eine Analyse wäre überhaupt nicht möglich. Daher wird die Proben-Oberfläche mit einer dünnen, elektrisch leitenden Kohlenstoffschicht bedampft.
Derselbe Effekt tritt natürlich im REM auf. Auch diese Proben können mit Kohlenstoff bedampft werden. Mit dem REM können jedoch auch 3-dimensionale Proben untersucht werden. Diese können nicht gut mit Kohlenstoff bedampft werden. Solche Proben werde stattdessen mit entweder Gold oder Platin besputtert.",https://vimeo.com/541034667,https://youtu.be/MK1jGJBydUM,
Elektronenstrahl-Mikrosonde (EPMA),1,2,none,14:05,"Mit der Mikrosonde schauen wir uns (i) an, wie die Probe aussieht: deren Struktur, Gefüge, Korngröße, usw. – also deren Petrographie. (ii) bestimmen wir mit der Mikrosonde die chemische Zusammensetzung der Probe, bzw. deren Phasen, um daraus die Minerale zu bestimmen,  Zonierungen der Minerale, Spurenelement-Gehalte, usw. – also deren Petrologie. Dabei können wir auf der Probe einzelne Punkte von bis zu deutlich weniger als 1 µm Durchmesser analysieren. Es können viele Punkte nebeneinander gemessen werden, um einen Line-Scan zu erhalten. Schließlich sind Element-maps möglich, Falschfarben-Bilder, auf denen die relativen Intensitäten eines Elements dargestellt sind.
Eine Mikrosonde verfügt über verschiedene Detektoren, um die Probenoberfläche abzubilden, dazu gehören: Rückstreuelektronen-Bilder (BSE – Backscatter Electron images), Sekundär-Elektronen Bilder (SE – secondary electron images), und Kathodolumineszenz (CL – cathodoluminescence images). BSE Bilder sind Phasen-Kontrast Bilder, in denen Phasen mit schweren Elementen heller sind. Darauf ist die Mineralogie einer Probe sehr gut zu erkennen. SE Bilder zeigen die 3-Dimensionale Probenoberfläche. Darauf sind z.B. Risse oder Verunreinigungen auf der Probe sehr gut zu erkennen. Auf CL Bildern können sehr gut feine Zonierungen, z.B. in Zirkon abgebildet werden.
Die chemische Analyse erfolgt mit einem energiedispersiven (EDS) oder einem winkeldispersiven Spektrometer (WDS). Eine EDS-Analyse geht sehr schnell, ist aber oft nicht ausreichend präzise. Eine WDS-Analyse ist aufwändiger und dauert länger, ist aber sehr viel präziser, bis deutlich hinunter in den <100 Gew.-ppm Bereich.",https://vimeo.com/541029802,https://youtu.be/hDVtq86ZyT0,
1.3. Rasterelektronen-Mikroskop (REM),,,,06:17,"Das verfügt über eine sehr andere Probenkammer als die Mikrosonde. Die Probenkammer des REM ist sehr viel größer, und es können auch 3-dimensionale Proben eingebaut und untersucht werden. So z.B. auch biologische Proben wie Pflanzen oder Tier(-teile). Das Raster wird daher häufig für bildgebende Untersuchungen verwendet, z.B. für die Morphologie oder Struktur einer Probe. Es sind dabei Vergrößerungen von deutlich über 100.000x möglich.
Das REM verfügt über Detektoren für BSE- und SE-Bilder, sowie über eine Schwarz/Weiß- sowie Farb-CL. Es gibt weiter ein EDS für chemische Analysen, sowie einen Detektor Rückstreu-Elektronen Diffraktometrie (EBSD – Electron Backscatter Diffraction). Mit diesem wird die Kristallographie der Minerale untersucht, und es kann bspw. gesehen werden, ob Minerale in einem Gefüge eingeregelt vorliegen, oder zufällig zueinander orientiert sind.",https://vimeo.com/541054877,,
1.4. Mikro-Röntgenfluoreszenz (µ.RFA),,,,01:58,"Für die µ.RFA werden wieder Dünnschliffe benötigt. Die Probe wird hier nicht mit einem Elektronenstrahl beschossen, sondern von Röntgenstrahlen beleuchtet. Ein bildgebendes Verfahren besitzt die µ.RFA nicht. Es wird ausschließlich die chemische Zusammensetzung der Probe ortsaufgelöst mit Hilfe eines EDS analysiert. Röntgenstrahlen können im Gegensatz zu einem Elektronenstrahl nur schwer fokussiert werden. Bei der µ.RFA erfolgt wird die Röntgenstrahlung durch ein Kapillar auf die Probe geleitet, und erlaubt eine Ortsauflösung im  zehner µm Bereich – also deutlich schlechter als in der EPMA oder dem REM. Eine konventionelle RFA ist tatsächlich gar nicht für die Ortsauflösung gedacht, sondern für Gesamtgesteinsanalysen. Dazu werden Schmelztabletten oder Pulverpresslinge des Gesamtgesteins hergestellt und dann deren chemische Zusammensetzung in der konventionellen RFA meist per WDS analysiert.",https://vimeo.com/541030264,,
1.5. OLAT Labor-Gruppe,,,,03:46,"Das Elektronenstrahl-Labor ist in einer OLAT-Gruppe abgebildet, welche vielfältige Informationen rund um das Labor zur Verfügung stellt, bspw. welche Geräte es gibt, wie diese heißen, grundlegende Informationen zu den Geräten, Video-Tutorials zur Bedienung der Geräte, der Belegungskalender, aktuelle Informationen in einem Blog – und vieles mehr. Wer das Labor nutzt, sollte sich hier eintragen lassen – aber auch jede*r Andere, die/der sich für das Labor, bzw. die dort vorhandenen Geräte interessiert.",https://vimeo.com/540179720,,